Invoice,StockCode,Description,Quantity,InvoiceDate,Price,Customer ID,Country,Cluster
510795,48187,DOOR MAT NEW ENGLAND,1,06/03/2010 16:45:00,7.49,12748.0,United Kingdom,2
501880,22059,CERAMIC STRWBERRY DESIGN MUG,1,03/21/2010 13:38:00,1.49,17285.0,United Kingdom,2
495952,21877,HOME SWEET HOME MUG,1,01/27/2010 17:53:00,3.36,,United Kingdom,2
501148,22379,RECYCLING BAG RETROSPOT ,10,03/14/2010 13:40:00,2.1,14646.0,Netherlands,2
524290,21272,SALLE DE BAIN HOOK,12,09/28/2010 12:54:00,1.25,14461.0,United Kingdom,2
533065,22090,PAPER BUNTING RETROSPOT,1,11/15/2010 17:04:00,5.91,,United Kingdom,2
500168,20754,RETRO RED SPOTTY WASHING UP GLOVES,6,03/05/2010 09:39:00,2.1,13476.0,United Kingdom,2
499765,22236,CAKE STAND 3 TIER MAGIC GARDEN,1,03/02/2010 13:15:00,25.49,,United Kingdom,2
527885,84949,SILVER HANGING T-LIGHT HOLDER,6,10/19/2010 12:05:00,1.65,15011.0,United Kingdom,2
525484,21730,GLASS STAR FROSTED T-LIGHT HOLDER,3,10/05/2010 15:52:00,4.95,14350.0,United Kingdom,2
496615,20730,STRAWBERRY CANDY BAG,1,02/03/2010 08:50:00,0.85,,United Kingdom,2
520197,85131A,BEADED PEARL HEART WHITE ON STICK,24,08/24/2010 15:14:00,0.38,13576.0,United Kingdom,2
520396,72760B,VINTAGE CREAM 3 BASKET CAKE STAND,1,08/25/2010 15:58:00,9.95,17963.0,United Kingdom,2
532723,21422,PORCELAIN ROSE SMALL,16,11/14/2010 12:58:00,0.85,13167.0,United Kingdom,2
501161,85031B,BLOSSOM IMAGES SCRAP BOOK SET,1,03/15/2010 09:28:00,3.36,,United Kingdom,2
501877,21644,ASSORTED TUTTI FRUTTI HEART BOX,12,03/21/2010 13:14:00,1.25,17611.0,United Kingdom,2
504893,84690,S/2 BEACH HUT STOOLS,2,04/18/2010 14:06:00,7.95,15972.0,United Kingdom,2
530844,82486,WOOD S/3 CABINET ANT WHITE FINISH,2,11/04/2010 14:21:00,7.95,16350.0,United Kingdom,2
503343,22114,HOT WATER BOTTLE TEA AND SYMPATHY,2,03/31/2010 13:10:00,3.95,15796.0,United Kingdom,2
516929,22149,FELTCRAFT 6 FLOWER FRIENDS,6,07/25/2010 12:49:00,2.1,13761.0,United Kingdom,2
515175,85174,S/4 CACTI CANDLES,12,07/08/2010 17:08:00,4.25,13777.0,United Kingdom,2
498492,22320,BIRDS MOBILE VINTAGE DESIGN,1,02/19/2010 10:56:00,11.87,,United Kingdom,2
537764,22804,CANDLEHOLDER PINK HANGING HEART,1,12/08/2010 12:06:00,2.95,16893.0,United Kingdom,2
514800,21612,SET 12 WILDFLOWER BOTANICAL T-LIGHT,6,07/06/2010 10:41:00,2.95,15650.0,United Kingdom,2
501652,20684,STRAWBERRY DREAM CHILDS UMBRELLA,1,03/18/2010 12:47:00,3.25,17841.0,United Kingdom,2
512937,20770,ABSTRACT CIRCLE JOURNAL ,2,06/20/2010 13:28:00,2.55,13634.0,United Kingdom,2
501893,22055,MINI CAKE STAND  HANGING STRAWBERY,1,03/21/2010 15:03:00,1.65,15005.0,United Kingdom,2
490685,84032B,CHARLIE + LOLA RED HOT WATER BOTTLE,4,12/07/2009 13:48:00,2.95,13206.0,United Kingdom,2
524388,22189,CREAM HEART CARD HOLDER,4,09/28/2010 18:11:00,3.95,15321.0,United Kingdom,2
501029,22457,NATURAL SLATE HEART CHALKBOARD ,6,03/11/2010 17:21:00,2.95,16011.0,United Kingdom,2
490074,21931,JUMBO STORAGE BAG SUKI,2,12/03/2009 14:39:00,4.3,,United Kingdom,2
523751,22173,METAL 4 HOOK HANGER FRENCH CHATEAU,8,09/23/2010 19:28:00,2.95,16497.0,United Kingdom,2
535274,21181,PLEASE ONE PERSON METAL SIGN,12,11/25/2010 13:51:00,2.1,14415.0,United Kingdom,2
494779,20854,BLUE PATCH PURSE PINK HEART,1,01/18/2010 12:55:00,1.65,18041.0,United Kingdom,2
533114,21212,PACK OF 72 RETROSPOT CAKE CASES,1,11/16/2010 12:22:00,0.55,14675.0,United Kingdom,2
517106,21212,PACK OF 72 RETRO SPOT CAKE CASES,3,07/26/2010 15:17:00,0.55,12867.0,United Kingdom,2
497588,84691,PACK 20 DOLLY PEGS,1,02/10/2010 17:16:00,0.85,17377.0,United Kingdom,2
504876,21623,VINTAGE UNION JACK MEMOBOARD,2,04/18/2010 12:44:00,9.95,14878.0,United Kingdom,2
C500565,85232B,SET/3 RUSSIAN DOLL STACKING TINS,-3,03/08/2010 15:48:00,4.95,15767.0,United Kingdom,2
516306,22386,JUMBO BAG PINK WITH WHITE SPOTS,10,07/19/2010 13:46:00,1.95,13178.0,United Kingdom,2
521558,21989,PACK OF 20 SKULL PAPER NAPKINS,12,09/07/2010 09:31:00,0.85,16314.0,United Kingdom,2
511087,20725,LUNCH BAG RED SPOTTY,10,06/06/2010 15:01:00,1.65,17682.0,United Kingdom,2
534800,21721,CANDY SHOP  STICKER SHEET,1,11/24/2010 12:04:00,0.85,17019.0,United Kingdom,2
522089,22334,DINOSAUR PARTY BAG + STICKER SET,2,09/12/2010 12:41:00,1.65,16387.0,United Kingdom,2
500504,84559D,3D SHEET OF SEA WORLD STICKERS,3,03/08/2010 13:41:00,0.85,16537.0,United Kingdom,2
509187,22468,BABUSHKA LIGHTS STRING OF 10,6,05/20/2010 17:00:00,6.75,15826.0,United Kingdom,2
519570,22189,CREAM HEART CARD HOLDER,4,08/18/2010 12:34:00,3.95,13593.0,United Kingdom,2
530070,20974,12 PENCILS SMALL TUBE SKULL,15,11/01/2010 11:59:00,0.65,16876.0,United Kingdom,2
496430,22172,METAL SHELF WITH RAIL ,1,02/01/2010 12:25:00,8.5,17362.0,United Kingdom,2
492387,48116,DOOR MAT MULTICOLOUR STRIPE,2,12/16/2009 15:13:00,6.75,15044.0,United Kingdom,2
531748,C2,CARRIAGE,1,11/09/2010 13:03:00,50.0,14156.0,EIRE,2
522359,37450,CERAMIC CAKE BOWL + HANGING CAKES,18,09/14/2010 10:58:00,2.55,13798.0,United Kingdom,2
522092,35832,WOOLLY HAT SOCK GLOVE ADVENT STRING,2,09/12/2010 13:03:00,2.95,15006.0,United Kingdom,2
532741,85048,15CM CHRISTMAS GLASS BALL 20 LIGHTS,36,11/14/2010 13:04:00,6.95,14882.0,United Kingdom,2
525288,21755,LOVE BUILDING BLOCK WORD,18,10/05/2010 08:45:00,5.45,14440.0,United Kingdom,2
495467,21211,SET OF 72 SKULL PAPER  DOILIES,12,01/25/2010 12:08:00,1.45,13001.0,United Kingdom,2
513615,20677,PINK SPOTTY BOWL,4,06/27/2010 12:25:00,1.25,15998.0,United Kingdom,2
500322,72802B,OCEAN SCENT CANDLE IN JEWELLED BOX,1,03/07/2010 12:06:00,4.25,16798.0,United Kingdom,2
537638,72807B,SET/3 OCEAN SCENT CANDLE JEWEL BOX,1,12/07/2010 15:28:00,8.47,,United Kingdom,2
530060,21429,RED GINGHAM ROSE JEWELLERY BOX,2,11/01/2010 11:35:00,3.36,,United Kingdom,2
530332,22348,TEA BAG PLATE RED RETROSPOT,4,11/02/2010 13:57:00,1.66,,United Kingdom,2
538014,72807B,SET/3 OCEAN SCENT CANDLE JEWEL BOX,12,12/09/2010 12:49:00,4.25,14440.0,United Kingdom,2
524299,22903,CALENDAR FAMILY FAVORITES,4,09/28/2010 13:13:00,2.95,14911.0,EIRE,2
489597,90120C,GREEN MURANO TWIST BRACELET,1,12/01/2009 14:28:00,4.33,,United Kingdom,2
537126,22748,POPPY'S PLAYHOUSE KITCHEN,1,12/05/2010 12:13:00,2.1,18118.0,United Kingdom,2
507712,85040A,S/4 PINK FLOWER CANDLES IN BOWL,1,05/11/2010 11:29:00,3.36,,United Kingdom,2
500462,21314,SMALL GLASS HEART TRINKET POT,3,03/08/2010 12:40:00,4.21,,United Kingdom,2
530958,22835,HOT WATER BOTTLE I AM SO POORLY,1,11/04/2010 18:54:00,4.65,16228.0,United Kingdom,2
519868,20719,WOODLAND CHARLOTTE BAG,1,08/20/2010 16:21:00,1.66,,United Kingdom,2
528919,21914,BLUE HARMONICA IN BOX ,2,10/25/2010 14:27:00,1.25,16259.0,United Kingdom,2
515475,84509G,SET OF 4 FAIRY CAKE PLACEMATS ,12,07/13/2010 09:35:00,3.75,16320.0,Unspecified,2
535584,22112,CHOCOLATE HOT WATER BOTTLE,3,11/26/2010 15:49:00,4.95,14135.0,United Kingdom,2
505510,21561,DINOSAUR LUNCH BOX WITH CUTLERY,2,04/22/2010 14:33:00,5.06,,United Kingdom,2
511544,84970L,SINGLE HEART ZINC T-LIGHT HOLDER,1,06/08/2010 17:48:00,2.13,,United Kingdom,2
522464,71403,"PINK/WHITE ""KEEP CLEAN"" BULLET BIN",1,09/14/2010 17:50:00,5.91,,United Kingdom,2
498906,84839,SWEETHEART KEY CABINET,2,02/23/2010 14:48:00,6.75,13490.0,United Kingdom,2
491684,22335,HEART DECORATION PAINTED ZINC ,6,12/13/2009 12:42:00,0.65,17287.0,United Kingdom,2
499858,21455,PAINTED YELLOW WOODEN DAISY,2,03/02/2010 17:04:00,1.66,,United Kingdom,2
502920,20973,12 PENCIL SMALL TUBE WOODLAND,3,03/29/2010 13:55:00,0.65,18041.0,United Kingdom,2
537645,21494,ROTATING LEAVES T-LIGHT HOLDER,1,12/07/2010 15:34:00,5.91,,United Kingdom,2
513762,11001,ASSTD DESIGN RACING CAR PEN,16,06/28/2010 12:58:00,1.69,12451.0,Switzerland,2
501145,21932,SCANDINAVIAN PAISLEY PICNIC BAG,3,03/14/2010 12:41:00,2.95,18149.0,United Kingdom,2
506100,22413,METAL SIGN TAKE IT OR LEAVE IT ,24,04/27/2010 13:06:00,2.95,16749.0,United Kingdom,2
532146,84997C,BLUE 3 PIECE POLKADOT CUTLERY SET,3,11/11/2010 11:55:00,3.75,15039.0,United Kingdom,2
532233,22671,FRENCH LAUNDRY SIGN BLUE METAL,2,11/11/2010 12:40:00,1.65,13719.0,United Kingdom,2
502087,85123A,WHITE HANGING HEART T-LIGHT HOLDER,6,03/22/2010 15:59:00,2.95,17496.0,United Kingdom,2
500312,85174,S/4 CACTI CANDLES,4,03/07/2010 11:31:00,4.25,17448.0,United Kingdom,2
514720,21657,MILK BOTTLE WITH GLASS STOPPER ,12,07/05/2010 16:35:00,5.95,14911.0,EIRE,2
532016,22510,GINGHAM BABUSHKA DOORSTOP,1,11/10/2010 12:54:00,3.75,17756.0,United Kingdom,2
491999,85099B,JUMBO BAG RED WHITE SPOTTY ,20,12/15/2009 11:20:00,1.95,14341.0,United Kingdom,2
521222,22072,RED RETROSPOT TEA CUP AND SAUCER ,1,09/03/2010 10:39:00,3.75,17287.0,United Kingdom,2
535346,22964,3 PIECE SPACEBOY COOKIE CUTTER SET,1,11/25/2010 16:44:00,2.1,12961.0,United Kingdom,2
501153,85123A,WHITE HANGING HEART T-LIGHT HOLDER,12,03/14/2010 15:07:00,2.95,15665.0,United Kingdom,2
499508,20975,12 PENCILS SMALL TUBE RED SPOTTY,1,02/28/2010 16:14:00,0.65,18069.0,United Kingdom,2
528912,22525,CHILDRENS GARDEN GLOVES PINK,1,10/25/2010 13:40:00,1.25,16241.0,United Kingdom,2
537375,21579,LOLITA  DESIGN  COTTON TOTE BAG,1,12/06/2010 12:55:00,2.25,17019.0,United Kingdom,2
493536,22135,LADLE LOVE HEART PINK,2,01/04/2010 15:29:00,0.42,17841.0,United Kingdom,2
500163,20983,12 PENCILS TALL TUBE RED SPOTTY,12,03/05/2010 08:45:00,0.85,12399.0,Belgium,2
505884,22423,REGENCY CAKESTAND 3 TIER,1,04/26/2010 13:54:00,12.75,14911.0,EIRE,2
516892,21527,RED RETROSPOT TRADITIONAL TEAPOT ,1,07/23/2010 15:09:00,16.98,,United Kingdom,2
514505,22033,BOTANICAL ROSE GREETING CARD,12,07/04/2010 11:40:00,0.42,17201.0,United Kingdom,2
516968,21890,S/6 WOODEN SKITTLES IN COTTON BAG,12,07/26/2010 10:03:00,2.95,15080.0,United Kingdom,2
536876,21846,PINK DIAMANTE PEN IN GIFT BOX,1,12/03/2010 11:36:00,4.21,,United Kingdom,2
509184,21472,LADYBIRD + BEE RAFFIA FOOD COVER,1,05/20/2010 16:49:00,3.75,16347.0,United Kingdom,2
510740,16168M,FUNKY MONKEY GIFT BAG MEDIUM,24,06/03/2010 11:50:00,0.42,15768.0,United Kingdom,2
524871,22469,HEART OF WICKER SMALL,12,10/01/2010 10:04:00,1.65,12935.0,United Kingdom,2
534054,22367,CHILDRENS APRON SPACEBOY DESIGN,3,11/21/2010 10:38:00,1.95,16746.0,United Kingdom,2
499897,37448,CERAMIC CAKE DESIGN SPOTTED MUG,24,03/03/2010 11:53:00,1.25,14298.0,United Kingdom,2
498434,85206B,PINK FELT EASTER EGG BASKET,54,02/18/2010 18:20:00,1.45,13952.0,United Kingdom,2
515479,21454,PAINTED PINK RABBIT ,1,07/13/2010 09:58:00,1.66,,United Kingdom,2
534382,22470,HEART OF WICKER LARGE,2,11/22/2010 12:44:00,2.95,14585.0,United Kingdom,2
498441,84988,SET OF 72 PINK HEART PAPER DOILIES,4,02/19/2010 09:37:00,2.98,,United Kingdom,2
533136,84029E,RED WOOLLY HOTTIE WHITE HEART.,1,11/16/2010 12:52:00,3.75,17203.0,United Kingdom,2
496470,22349,"DOG BOWL , CHASING BALL DESIGN",1,02/01/2010 15:23:00,3.75,14540.0,United Kingdom,2
511963,22619,SET OF 6 SOLDIER SKITTLES,16,06/11/2010 13:29:00,3.75,12429.0,Denmark,2
532993,22623,BOX OF VINTAGE JIGSAW BLOCKS ,3,11/15/2010 14:26:00,4.95,14156.0,EIRE,2
533114,22557,PLASTERS IN TIN VINTAGE PAISLEY ,2,11/16/2010 12:22:00,1.65,14675.0,United Kingdom,2
528613,22077,6 RIBBONS RUSTIC CHARM,1,10/22/2010 15:57:00,3.36,,United Kingdom,2
519249,22507,MEMO BOARD RETROSPOT  DESIGN,4,08/15/2010 15:01:00,4.95,,EIRE,2
503428,21918,SET 12 KIDS COLOUR  CHALK STICKS,1,03/31/2010 17:31:00,0.81,,United Kingdom,2
526204,22855,FINE WICKER HEART ,2,10/10/2010 13:23:00,1.25,14040.0,United Kingdom,2
502827,21981,PACK OF 12 WOODLAND TISSUES ,48,03/28/2010 11:45:00,0.29,15289.0,United Kingdom,2
518505,21280,VINTAGE KITCHEN PRINT VEGETABLES,1248,08/09/2010 13:10:00,0.25,14277.0,France,0
527447,22760,"TRAY, BREAKFAST IN BED",1,10/18/2010 09:38:00,12.75,18065.0,United Kingdom,2
519908,82551,LAUNDRY 15C METAL SIGN,5,08/22/2010 13:41:00,1.25,15665.0,United Kingdom,2
532063,21218,RED SPOTTY BISCUIT TIN,1,11/10/2010 14:48:00,8.47,,United Kingdom,2
530288,22549,PICTURE DOMINOES,4,11/02/2010 12:16:00,1.45,14593.0,United Kingdom,2
519916,21622,VINTAGE UNION JACK CUSHION COVER,4,08/22/2010 14:01:00,4.95,14221.0,United Kingdom,2
503503,10002,INFLATABLE POLITICAL GLOBE ,24,04/01/2010 12:30:00,0.85,12583.0,France,2
520066,22423,REGENCY CAKESTAND 3 TIER,20,08/23/2010 16:19:00,10.95,15043.0,United Kingdom,2
528783,22113,GREY HEART HOT WATER BOTTLE,4,10/25/2010 10:00:00,3.75,13769.0,United Kingdom,2
536544,85186A,EASTER BUNNY GARLAND OF FLOWERS,1,12/01/2010 14:32:00,0.85,,United Kingdom,2
492420,90186B,CRYSTAL HOOP EARRING FLORAL LEAF,1,12/16/2009 17:36:00,2.95,,United Kingdom,2
491077,85232B,SET/3 RUSSIAN DOLL STACKING TINS,4,12/09/2009 12:57:00,4.95,14593.0,United Kingdom,2
C528358,22423,REGENCY CAKESTAND 3 TIER,-5,10/21/2010 15:08:00,10.95,12471.0,Germany,2
533348,22379,RECYCLING BAG RETROSPOT ,2,11/17/2010 09:23:00,4.21,,United Kingdom,2
536464,21212,PACK OF 72 RETROSPOT CAKE CASES,1,12/01/2010 12:23:00,0.55,17968.0,United Kingdom,2
524939,21642,ASSORTED TUTTI FRUTTI PEN,1,10/01/2010 12:07:00,0.85,17360.0,United Kingdom,2
518276,21312,LARGE CHUNKY GLASS ROMAN BOWL,32,08/06/2010 10:06:00,1.95,16103.0,United Kingdom,2
491155,22200,FRYING PAN PINK POLKADOT ,1,12/10/2009 09:49:00,8.65,,United Kingdom,2
537434,22246,MAGIC GARDEN FELT GARLAND ,4,12/06/2010 16:57:00,4.21,,United Kingdom,2
521515,22072,RED RETROSPOT TEA CUP AND SAUCER ,1,09/06/2010 14:36:00,3.75,13736.0,United Kingdom,2
528383,22594,CHRISTMAS GINGHAM TREE,3,10/21/2010 18:21:00,0.85,14686.0,United Kingdom,2
494237,21897,POTTING SHED CANDLE CITRONELLA,1,01/12/2010 15:27:00,2.95,15550.0,United Kingdom,2
505714,15044A,PINK PAPER PARASOL ,6,04/25/2010 13:09:00,2.95,13863.0,United Kingdom,2
494476,21390,FILIGRIS HEART WITH BUTTERFLY,24,01/14/2010 15:24:00,1.25,15222.0,United Kingdom,2
494381,21520,BOOZE & WOMEN GREETING CARD ,1,01/13/2010 17:44:00,0.84,,United Kingdom,2
524163,85032D,YULETIDE IMAGES GIFT WRAP SET,1,09/27/2010 16:20:00,2.1,17524.0,United Kingdom,2
517747,15056N,EDWARDIAN PARASOL NATURAL,3,08/02/2010 09:18:00,5.95,17049.0,United Kingdom,2
504924,21758,VINTAGE SHELLS PRINT,1,04/19/2010 10:49:00,12.72,,United Kingdom,2
507387,85036C,ROSE 1 WICK MORRIS BOXED CANDLE,1,05/09/2010 12:10:00,4.25,17137.0,United Kingdom,2
514497,22637,PIGGY BANK RETROSPOT ,1,07/04/2010 10:36:00,2.55,16782.0,United Kingdom,2
501291,22294,HEART FILIGREE DOVE  SMALL,5,03/15/2010 15:33:00,1.25,14343.0,United Kingdom,2
502880,84969,ASSORTED COLOUR SET 6 TEASPOONS,1,03/29/2010 10:37:00,4.25,17994.0,United Kingdom,2
523205,21535,RED RETROSPOT SMALL MILK JUG,48,09/21/2010 10:11:00,2.1,16586.0,United Kingdom,2
491633,85107,CUT GLASS T-LIGHT HOLDER OCTAGON,36,12/11/2009 15:37:00,2.55,17958.0,United Kingdom,2
533348,35958,FOLKART ZINC STAR CHRISTMAS DEC,3,11/17/2010 09:23:00,1.66,,United Kingdom,2
522273,85136C,RED SHARK HELICOPTER,1,09/13/2010 12:41:00,7.95,16470.0,United Kingdom,2
514306,22474,SPACEBOY TV DINNER TRAY,1,07/01/2010 12:57:00,4.95,16926.0,United Kingdom,2
523559,22629,SPACEBOY LUNCH BOX ,1,09/22/2010 15:13:00,2.51,,United Kingdom,2
517739,85131A,BEADED PEARL HEART WHITE ON STICK,4,08/01/2010 14:40:00,1.25,13474.0,United Kingdom,2
493860,15056N,EDWARDIAN PARASOL NATURAL,8,01/07/2010 16:19:00,5.95,13767.0,United Kingdom,2
529994,21385,IVORY HANGING DECORATION  HEART,9,10/31/2010 16:26:00,0.85,16984.0,United Kingdom,2
511655,85099C,JUMBO  BAG BAROQUE BLACK WHITE,6,06/09/2010 14:09:00,1.95,14104.0,United Kingdom,2
498884,22241,GARLAND WOODEN HAPPY EASTER,12,02/23/2010 12:55:00,1.25,12820.0,United Kingdom,2
513468,21401,BLUE PUDDING SPOON,24,06/24/2010 16:24:00,0.42,12741.0,USA,2
510507,37500,TEA TIME TEAPOT IN GIFT BOX,2,06/01/2010 12:45:00,9.95,16884.0,United Kingdom,2
494808,21012,ANTIQUE ALL GLASS CANDLESTICK,2,01/18/2010 16:09:00,2.1,17231.0,United Kingdom,2
515611,DOT,DOTCOM POSTAGE,1,07/13/2010 15:52:00,0.0,,United Kingdom,2
490667,21385,IVORY HANGING DECORATION  HEART,6,12/07/2009 12:32:00,0.85,13234.0,United Kingdom,2
533133,21818,GLITTER CHRISTMAS HEART ,5,11/16/2010 12:50:00,0.85,15850.0,United Kingdom,2
517517,22088,PAPER BUNTING COLOURED LACE,6,07/29/2010 13:45:00,2.95,13999.0,United Kingdom,2
512589,22469,HEART OF WICKER SMALL,2,06/16/2010 16:04:00,3.36,,United Kingdom,2
510064,21069,VINTAGE BILLBOARD TEA MUG,1,05/27/2010 10:56:00,2.51,,United Kingdom,2
534305,84029E,RED WOOLLY HOTTIE WHITE HEART.,12,11/22/2010 11:32:00,3.75,17491.0,United Kingdom,2
521467,84879,ASSORTED COLOUR BIRD ORNAMENT,8,09/06/2010 11:49:00,1.69,13842.0,United Kingdom,2
532821,22441,GROW YOUR OWN BASIL IN ENAMEL MUG,1,11/14/2010 16:32:00,2.1,14382.0,United Kingdom,2
495020,21232,STRAWBERRY CERAMIC TRINKET BOX,4,01/20/2010 13:24:00,1.25,16200.0,United Kingdom,2
508333,84798B,PURPLE FOXGLOVE ARTIIFCIAL FLOWER,72,05/14/2010 12:00:00,0.65,13694.0,United Kingdom,2
532746,22502,PICNIC BASKET WICKER SMALL,8,11/14/2010 13:13:00,5.95,13384.0,United Kingdom,2
493073,20966,SANDWICH BATH SPONGE,8,12/22/2009 09:41:00,2.57,,United Kingdom,2
523659,21232,STRAWBERRY CERAMIC TRINKET BOX,1,09/23/2010 13:54:00,1.25,18096.0,United Kingdom,2
494618,22082,RIBBON REEL STRIPES DESIGN ,20,01/15/2010 14:48:00,1.65,17871.0,United Kingdom,2
496881,22320,BIRDS MOBILE VINTAGE DESIGN,1,02/04/2010 13:53:00,5.95,17841.0,United Kingdom,2
517871,22611,VINTAGE UNION JACK SHOPPING BAG,1,08/02/2010 15:25:00,4.95,16814.0,United Kingdom,2
504459,21115,ROSE CARAVAN DOORSTOP,1,04/13/2010 16:07:00,6.75,14998.0,United Kingdom,2
524724,21891,TRADITIONAL WOODEN SKIPPING ROPE,12,09/30/2010 14:07:00,1.25,14742.0,United Kingdom,2
506709,22505,MEMO BOARD COTTAGE DESIGN,2,05/02/2010 15:10:00,4.95,15426.0,United Kingdom,2
490461,22115,METAL SIGN EMPIRE TEA,1,12/06/2009 12:07:00,2.95,13736.0,United Kingdom,2
533986,22272,FELTCRAFT DOLL MARIA,1,11/19/2010 13:52:00,2.95,18036.0,United Kingdom,2
535288,22557,PLASTERS IN TIN VINTAGE PAISLEY ,24,11/25/2010 14:27:00,1.65,17640.0,United Kingdom,2
513616,21539,RED RETROSPOT BUTTER DISH,2,06/27/2010 12:27:00,4.95,16059.0,United Kingdom,2
500663,21371,MIRRORED WALL ART POPPIES,6,03/09/2010 12:10:00,2.55,17700.0,United Kingdom,2
537362,22759,SET OF 3 NOTEBOOKS IN PARCEL,4,12/06/2010 12:34:00,1.65,17596.0,United Kingdom,2
507376,21900,"KEY FOB , SHED",3,05/09/2010 11:29:00,0.65,13979.0,United Kingdom,2
530426,22898,CHILDRENS APRON APPLES DESIGN,8,11/03/2010 10:20:00,1.95,14911.0,EIRE,2
535858,22904,CALENDAR PAPER CUT DESIGN,6,11/29/2010 10:41:00,2.95,,EIRE,2
506146,84691,PACK 20 DOLLY PEGS,1,04/27/2010 16:45:00,1.66,,United Kingdom,2
494359,22116,METAL SIGN HIS DINNER IS SERVED,1,01/13/2010 15:24:00,2.95,17962.0,United Kingdom,2
517626,22023,EMPIRE BIRTHDAY CARD,12,07/30/2010 12:10:00,0.42,16428.0,United Kingdom,2
526091,22411,JUMBO SHOPPER VINTAGE RED PAISLEY,10,10/08/2010 12:18:00,1.95,13564.0,United Kingdom,2
523327,22029,SPACEBOY BIRTHDAY CARD,12,09/21/2010 14:22:00,0.42,14761.0,United Kingdom,2
517094,22094,RED POLKA DOT TISSUE BOX,1,07/26/2010 14:36:00,2.51,,United Kingdom,2
490494,35095A,BLUE VICTORIAN FABRIC OVAL BOX,6,12/06/2009 13:29:00,0.42,17561.0,United Kingdom,2
494144,90098,NECKLACE+BRACELET PINK BUTTERFLY,1,01/11/2010 14:35:00,1.66,,United Kingdom,2
505203,16046,TEATIME PEN CASE & PENS,1,04/20/2010 16:24:00,1.66,,United Kingdom,2
527053,21181,PLEASE ONE PERSON METAL SIGN,1,10/14/2010 13:05:00,2.1,14343.0,United Kingdom,2
516629,72741,GRAND CHOCOLATECANDLE,18,07/22/2010 10:09:00,1.45,16736.0,United Kingdom,2
523937,21154,RED SPOTTY OVEN GLOVE ,20,09/26/2010 10:50:00,1.25,15201.0,United Kingdom,2
537434,90200D,PINK SWEETHEART BRACELET,1,12/06/2010 16:57:00,4.24,,United Kingdom,2
512891,22295,HEART FILIGREE DOVE LARGE,12,06/18/2010 12:19:00,1.65,15984.0,United Kingdom,2
501444,21866,UNION JACK FLAG LUGGAGE TAG,12,03/16/2010 14:08:00,1.25,17716.0,United Kingdom,2
519177,21692,SILVER LATTICE VANILLA CANDLE POT,6,08/13/2010 14:40:00,3.75,17589.0,United Kingdom,2
528477,22028,PENNY FARTHING BIRTHDAY CARD,12,10/22/2010 12:02:00,0.42,18022.0,United Kingdom,2
535091,22585,PACK OF 6 BIRDY GIFT TAGS,12,11/25/2010 10:20:00,1.25,14304.0,United Kingdom,2
537418,21680,WOODLAND  STICKERS,6,12/06/2010 15:13:00,0.85,17884.0,United Kingdom,2
493820,21682,LARGE MEDINA STAMPED METAL BOWL ,3,01/07/2010 12:37:00,4.95,13821.0,United Kingdom,2
515455,22150,3 STRIPEY MICE FELTCRAFT,10,07/12/2010 15:00:00,1.95,15673.0,United Kingdom,2
513161,48116,DOOR MAT MULTICOLOUR STRIPE,2,06/22/2010 10:51:00,7.49,13510.0,United Kingdom,2
C538110,21232,STRAWBERRY CERAMIC TRINKET BOX,-144,12/09/2010 15:24:00,1.06,17307.0,United Kingdom,2
499308,84077,WORLD WAR 2 GLIDERS ASSTD DESIGNS,48,02/26/2010 10:11:00,0.21,14329.0,United Kingdom,2
527614,71459,HANGING JAM JAR T-LIGHT HOLDER,12,10/18/2010 13:44:00,0.85,13152.0,United Kingdom,2
522858,21679,SKULLS  STICKERS,1,09/17/2010 11:33:00,1.66,,United Kingdom,2
492784,84997C,BLUE 3 PIECE MINI DOTS CUTLERY SET,1,12/18/2009 17:24:00,3.75,17841.0,United Kingdom,2
506820,21158,MOODY GIRL DOOR HANGER ,24,05/04/2010 12:49:00,1.45,17504.0,United Kingdom,2
532299,22898,CHILDRENS APRON APPLES DESIGN,1,11/11/2010 13:53:00,1.95,17954.0,United Kingdom,2
502118,85198,ASSORTED FARMYARD ANIMALS IN BUCKET,48,03/23/2010 11:13:00,0.85,15614.0,United Kingdom,2
501010,22480,RED TEA TOWEL CLASSIC DESIGN,3,03/11/2010 15:33:00,1.25,13715.0,United Kingdom,2
514675,22053,EMPIRE DESIGN ROSETTE,4,07/05/2010 13:28:00,1.25,13069.0,United Kingdom,2
493568,22195,HEART MEASURING SPOONS LARGE,12,01/05/2010 09:16:00,1.65,16875.0,United Kingdom,2
507388,21610,SET 12 PEAR BOTANICAL T-LIGHTS,1,05/09/2010 12:12:00,2.95,14474.0,United Kingdom,2
533578,84949,SILVER HANGING T-LIGHT HOLDER,2,11/18/2010 11:09:00,1.65,16905.0,United Kingdom,2
512776,22384,LUNCH BAG PINK RETROSPOT,6,06/17/2010 17:41:00,1.65,15023.0,United Kingdom,2
533560,20973,12 PENCIL SMALL TUBE WOODLAND,24,11/18/2010 10:05:00,0.65,18062.0,United Kingdom,2
517237,22377,BOTTLE BAG RETROSPOT ,10,07/27/2010 14:02:00,2.1,15062.0,United Kingdom,2
505863,22138,BAKING SET 9 PIECE RETROSPOT ,1,04/26/2010 13:24:00,11.02,,United Kingdom,2
522720,22685,"FRENCH BLUE METAL DOOR SIGN, 0",10,09/16/2010 12:20:00,1.25,16912.0,United Kingdom,2
500316,21291,SMALL SPOTTY CHOCOLATE GIFT BAG ,16,03/07/2010 11:58:00,0.85,13508.0,United Kingdom,2
495720,85066,CREAM SWEETHEART MINI CHEST,2,01/26/2010 14:43:00,12.75,17059.0,United Kingdom,2
536024,22141,CHRISTMAS CRAFT TREE TOP ANGEL,5,11/29/2010 16:13:00,2.1,17338.0,United Kingdom,2
C511648,22621,TRADITIONAL KNITTING NANCY,-12,06/09/2010 13:54:00,1.45,13650.0,United Kingdom,2
530332,22573,STAR WOODEN CHRISTMAS DECORATION,2,11/02/2010 13:57:00,1.66,,United Kingdom,2
514360,22716,CARD CIRCUS PARADE,12,07/01/2010 17:48:00,0.42,13004.0,United Kingdom,2
509311,21509,COWBOYS AND INDIANS BIRTHDAY CARD ,12,05/21/2010 12:06:00,0.42,13089.0,United Kingdom,2
536592,22919,HERB MARKER MINT,1,12/01/2010 17:06:00,1.66,,United Kingdom,2
521555,21381,MINI WOODEN HAPPY BIRTHDAY GARLAND,1,09/06/2010 16:17:00,3.36,,United Kingdom,2
503006,84937,KASHMIR FOLKART TUMBLERS,1,03/29/2010 15:00:00,11.02,,United Kingdom,2
C498572,22147,FELTCRAFT BUTTERFLY HEARTS,-2,02/21/2010 13:03:00,1.45,17372.0,United Kingdom,2
523792,21899,"KEY FOB , GARAGE DESIGN",3,09/24/2010 11:34:00,0.65,14994.0,United Kingdom,2
532354,22147,FELTCRAFT BUTTERFLY HEARTS,40,11/11/2010 16:40:00,1.25,13316.0,United Kingdom,2
C499749,21869,POTTING SHED COFFEE MUG,-1,03/02/2010 11:41:00,1.25,15290.0,United Kingdom,2
495244,21096,SET/6 FRUIT SALAD  PAPER PLATES,12,01/22/2010 10:51:00,0.85,15179.0,United Kingdom,2
537237,84923,PINK BUTTERFLY HANDBAG W BOBBLES,2,12/06/2010 09:58:00,4.21,,United Kingdom,2
C497008,90065A,WHITE VINTAGE CRYSTAL BRACELET,-1,02/05/2010 12:33:00,7.22,,United Kingdom,2
512694,21203,BUTTERFLIES  HONEYCOMB GARLAND,2,06/17/2010 11:52:00,1.65,14710.0,United Kingdom,2
526409,21867,PINK UNION JACK  LUGGAGE TAG,1,10/11/2010 13:57:00,1.25,15920.0,United Kingdom,2
510675,22556,PLASTERS IN TIN CIRCUS PARADE ,2,06/02/2010 16:20:00,1.65,17841.0,United Kingdom,2
526109,21215,IVORY PAPER CUP CAKE CASES ,6,10/08/2010 12:58:00,2.13,,United Kingdom,2
531387,22409,MONEY BOX BISCUITS DESIGN,1,11/08/2010 09:20:00,2.51,,United Kingdom,2
513647,84997B,RED 3 PIECE MINI DOTS CUTLERY SET,144,06/28/2010 08:28:00,3.39,14646.0,Netherlands,2
513811,21467,CHERRY CROCHET FOOD COVER,12,06/29/2010 09:39:00,3.75,14735.0,United Kingdom,2
497512,22185,SLATE TILE NATURAL HANGING,9,02/10/2010 12:26:00,1.65,17201.0,United Kingdom,2
493074,35647,VINTAGE BEAD PINK SHADE ,1,12/22/2009 09:45:00,2.57,,United Kingdom,2
531863,20713,JUMBO BAG OWLS,2,11/10/2010 10:50:00,1.95,13671.0,United Kingdom,2
493812,37492D,PURPLE GREEN FLOWER PIGGY BANK,12,01/07/2010 11:52:00,1.65,13081.0,United Kingdom,2
526391,85025C,PINK HEART SHAPE PHOTO FRAME,2,10/11/2010 13:17:00,1.65,16919.0,United Kingdom,2
494147,20616,CHERRY BLOSSOM PASSPORT COVER,1,01/11/2010 14:39:00,1.66,,United Kingdom,2
502055,22080,RIBBON REEL SPOTS DESIGN ,5,03/22/2010 14:30:00,1.65,13357.0,United Kingdom,2
517732,20685,DOORMAT RED SPOT,2,08/01/2010 13:48:00,7.49,17618.0,United Kingdom,2
490685,84029C,BROWN FURRY HOT WATER BOTTLE,3,12/07/2009 13:48:00,3.75,13206.0,United Kingdom,2
503185,22267,EASTER DECORATION EGG BUNNY ,4,03/30/2010 14:29:00,2.51,,United Kingdom,2
527375,21380,WOODEN HAPPY BIRTHDAY GARLAND,1,10/17/2010 12:34:00,2.95,14850.0,United Kingdom,2
501875,22488,NATURAL SLATE RECTANGLE CHALKBOARD,12,03/21/2010 12:39:00,1.65,16168.0,United Kingdom,2
514639,85099B,JUMBO BAG RED RETROSPOT,100,07/05/2010 12:38:00,1.65,14680.0,United Kingdom,2
535803,84988,SET OF 72 PINK HEART PAPER DOILIES,1,11/28/2010 14:57:00,1.45,14410.0,United Kingdom,2
509787,21723,,-40,05/25/2010 17:10:00,0.0,,United Kingdom,2
513050,85049C,ROMANTIC PINKS RIBBONS ,2,06/21/2010 13:18:00,1.25,14493.0,United Kingdom,2
516747,22219,LOVEBIRD HANGING DECORATION WHITE ,12,07/22/2010 15:01:00,0.85,14732.0,United Kingdom,2
524368,22557,PLASTERS IN TIN VINTAGE PAISLEY ,1,09/28/2010 17:18:00,3.36,,United Kingdom,2
527444,72816,SET/3 CHRISTMAS DECOUPAGE CANDLES,1,10/18/2010 09:28:00,2.51,,United Kingdom,2
534859,22837,HOT WATER BOTTLE BABUSHKA ,2,11/24/2010 13:56:00,9.32,,United Kingdom,2
523199,21485,RED SPOT HEART HOT WATER BOTTLE,24,09/21/2010 09:19:00,4.25,16133.0,United Kingdom,2
